<?xml version="1.0" encoding="utf-8"?>
<!DOCTYPE parameters [
    <!ELEMENT parameters (#PCDATA|parameter)*>
    <!ATTLIST parameters count CDATA #REQUIRED>
    <!ELEMENT parameter (#PCDATA|category|item|name|values)*>
    <!ELEMENT category (#PCDATA)>
    <!ELEMENT item (#PCDATA)>
    <!ELEMENT name (#PCDATA)>
    <!ELEMENT values (#PCDATA)>
    ]>
<parameters count="93">
    <parameter>
        <item>9</item>
        <category>1</category>
        <name>1</name>
        <values>181,200</values>
    </parameter>
    <parameter>
        <item>181</item>
        <category>1</category>
        <name>1</name>
        <values>9</values>
    </parameter>
    <parameter>
        <item>200</item>
        <category>1</category>
        <name>1</name>
        <values>9</values>
    </parameter>
    <parameter>
        <item>109</item>
        <category>1</category>
        <name>1</name>
        <values>180</values>
    </parameter>
    <parameter>
        <item>180</item>
        <category>1</category>
        <name>1</name>
        <values>109</values>
    </parameter>
    <parameter>
        <item>107</item>
        <category>1</category>
        <name>1</name>
        <values>175</values>
    </parameter>
    <parameter>
        <item>175</item>
        <category>1</category>
        <name>1</name>
        <values>107</values>
    </parameter>
    <parameter>
        <item>87</item>
        <category>1</category>
        <name>1</name>
        <values>121</values>
    </parameter>
    <parameter>
        <item>216</item>
        <category>1</category>
        <name>1</name>
        <values>121</values>
    </parameter>
    <parameter>
        <item>121</item>
        <category>1</category>
        <name>1</name>
        <values>87,216</values>
    </parameter>
    <parameter>
        <item>85</item>
        <category>1</category>
        <name>1</name>
        <values>120,123</values>
    </parameter>
    <parameter>
        <item>120</item>
        <category>1</category>
        <name>1</name>
        <values>85,123</values>
    </parameter>
    <parameter>
        <item>123</item>
        <category>1</category>
        <name>1</name>
        <values>85,120</values>
    </parameter>
    <parameter>
        <item>57</item>
        <category>1</category>
        <name>1</name>
        <values>159</values>
    </parameter>
    <parameter>
        <item>159</item>
        <category>1</category>
        <name>1</name>
        <values>57</values>
    </parameter>
    <parameter>
        <item>2</item>
        <category>1</category>
        <name>1</name>
        <values>49,54,164,254</values>
    </parameter>
    <parameter>
        <item>49</item>
        <category>1</category>
        <name>1</name>
        <values>2,54,164,254</values>
    </parameter>
    <parameter>
        <item>54</item>
        <category>1</category>
        <name>1</name>
        <values>2,49,164,254</values>
    </parameter>
    <parameter>
        <item>164</item>
        <category>1</category>
        <name>1</name>
        <values>2,49,54,254</values>
    </parameter>
    <parameter>
        <item>254</item>
        <category>1</category>
        <name>1</name>
        <values>2,49,54,164</values>
    </parameter>
    <parameter>
        <item>104</item>
        <category>1</category>
        <name>1</name>
        <values>136</values>
    </parameter>
    <parameter>
        <item>136</item>
        <category>1</category>
        <name>1</name>
        <values>104</values>
    </parameter>
    <parameter>
        <item>70</item>
        <category>1</category>
        <name>1</name>
        <values>202</values>
    </parameter>
    <parameter>
        <item>202</item>
        <category>1</category>
        <name>1</name>
        <values>70</values>
    </parameter>
    <parameter>
        <item>80</item>
        <category>1</category>
        <name>1</name>
        <values>81</values>
    </parameter>
    <parameter>
        <item>81</item>
        <category>1</category>
        <name>1</name>
        <values>80</values>
    </parameter>
    <parameter>
        <item>83</item>
        <category>1</category>
        <name>1</name>
        <values>273</values>
    </parameter>
    <parameter>
        <item>273</item>
        <category>1</category>
        <name>1</name>
        <values>83</values>
    </parameter>
    <parameter>
        <item>199</item>
        <category>1</category>
        <name>1</name>
        <values>313</values>
    </parameter>
    <parameter>
        <item>313</item>
        <category>1</category>
        <name>1</name>
        <values>199</values>
    </parameter>
    <parameter>
        <item>108</item>
        <category>1</category>
        <name>1</name>
        <values>112</values>
    </parameter>
    <parameter>
        <item>112</item>
        <category>1</category>
        <name>1</name>
        <values>108</values>
    </parameter>
    <parameter>
        <item>155</item>
        <category>1</category>
        <name>1</name>
        <values>236</values>
    </parameter>
    <parameter>
        <item>236</item>
        <category>1</category>
        <name>1</name>
        <values>155</values>
    </parameter>
    <parameter>
        <item>11</item>
        <category>1</category>
        <name>1</name>
        <values>21</values>
    </parameter>
    <parameter>
        <item>21</item>
        <category>1</category>
        <name>1</name>
        <values>11</values>
    </parameter>
    <parameter>
        <item>14</item>
        <category>1</category>
        <name>1</name>
        <values>219</values>
    </parameter>
    <parameter>
        <item>219</item>
        <category>1</category>
        <name>1</name>
        <values>14</values>
    </parameter>
    <parameter>
        <item>22</item>
        <category>1</category>
        <name>1</name>
        <values>29</values>
    </parameter>
    <parameter>
        <item>29</item>
        <category>1</category>
        <name>1</name>
        <values>22</values>
    </parameter>
    <parameter>
        <item>2</item>
        <category>1</category>
        <name>2</name>
        <values>1</values>
    </parameter>
    <parameter>
        <item>3</item>
        <category>1</category>
        <name>2</name>
        <values>1</values>
    </parameter>
    <parameter>
        <item>4</item>
        <category>1</category>
        <name>2</name>
        <values>1</values>
    </parameter>
    <parameter>
        <item>5</item>
        <category>1</category>
        <name>2</name>
        <values>1</values>
    </parameter>
    <parameter>
        <item>6</item>
        <category>1</category>
        <name>2</name>
        <values>1</values>
    </parameter>
    <parameter>
        <item>7</item>
        <category>1</category>
        <name>2</name>
        <values>1</values>
    </parameter>
    <parameter>
        <item>8</item>
        <category>1</category>
        <name>2</name>
        <values>2</values>
    </parameter>
    <parameter>
        <item>11</item>
        <category>1</category>
        <name>2</name>
        <values>3</values>
    </parameter>
    <parameter>
        <item>14</item>
        <category>1</category>
        <name>2</name>
        <values>4</values>
    </parameter>
    <parameter>
        <item>19</item>
        <category>1</category>
        <name>2</name>
        <values>2</values>
    </parameter>
    <parameter>
        <item>37</item>
        <category>1</category>
        <name>2</name>
        <values>4</values>
    </parameter>
    <parameter>
        <item>41</item>
        <category>1</category>
        <name>2</name>
        <values>4</values>
    </parameter>
    <parameter>
        <item>43</item>
        <category>1</category>
        <name>2</name>
        <values>1</values>
    </parameter>
    <parameter>
        <item>44</item>
        <category>1</category>
        <name>2</name>
        <values>1</values>
    </parameter>
    <parameter>
        <item>46</item>
        <category>1</category>
        <name>2</name>
        <values>3</values>
    </parameter>
    <parameter>
        <item>48</item>
        <category>1</category>
        <name>2</name>
        <values>4</values>
    </parameter>
    <parameter>
        <item>57</item>
        <category>1</category>
        <name>2</name>
        <values>4</values>
    </parameter>
    <parameter>
        <item>70</item>
        <category>1</category>
        <name>2</name>
        <values>4</values>
    </parameter>
    <parameter>
        <item>81</item>
        <category>1</category>
        <name>2</name>
        <values>4</values>
    </parameter>
    <parameter>
        <item>89</item>
        <category>1</category>
        <name>2</name>
        <values>2</values>
    </parameter>
    <parameter>
        <item>91</item>
        <category>1</category>
        <name>2</name>
        <values>2</values>
    </parameter>
    <parameter>
        <item>99</item>
        <category>1</category>
        <name>2</name>
        <values>2</values>
    </parameter>
    <parameter>
        <item>101</item>
        <category>1</category>
        <name>2</name>
        <values>4</values>
    </parameter>
    <parameter>
        <item>104</item>
        <category>1</category>
        <name>2</name>
        <values>3</values>
    </parameter>
    <parameter>
        <item>105</item>
        <category>1</category>
        <name>2</name>
        <values>3</values>
    </parameter>
    <parameter>
        <item>113</item>
        <category>1</category>
        <name>2</name>
        <values>4</values>
    </parameter>
    <parameter>
        <item>122</item>
        <category>1</category>
        <name>2</name>
        <values>4</values>
    </parameter>
    <parameter>
        <item>123</item>
        <category>1</category>
        <name>2</name>
        <values>2</values>
    </parameter>
    <parameter>
        <item>137</item>
        <category>1</category>
        <name>2</name>
        <values>2</values>
    </parameter>
    <parameter>
        <item>138</item>
        <category>1</category>
        <name>2</name>
        <values>2</values>
    </parameter>
    <parameter>
        <item>139</item>
        <category>1</category>
        <name>2</name>
        <values>3</values>
    </parameter>
    <parameter>
        <item>140</item>
        <category>1</category>
        <name>2</name>
        <values>2</values>
    </parameter>
    <parameter>
        <item>141</item>
        <category>1</category>
        <name>2</name>
        <values>2</values>
    </parameter>
    <parameter>
        <item>150</item>
        <category>1</category>
        <name>2</name>
        <values>4</values>
    </parameter>
    <parameter>
        <item>153</item>
        <category>1</category>
        <name>2</name>
        <values>1</values>
    </parameter>
    <parameter>
        <item>158</item>
        <category>1</category>
        <name>2</name>
        <values>4</values>
    </parameter>
    <parameter>
        <item>167</item>
        <category>1</category>
        <name>2</name>
        <values>3</values>
    </parameter>
    <parameter>
        <item>168</item>
        <category>1</category>
        <name>2</name>
        <values>4</values>
    </parameter>
    <parameter>
        <item>169</item>
        <category>1</category>
        <name>2</name>
        <values>4</values>
    </parameter>
    <parameter>
        <item>170</item>
        <category>1</category>
        <name>2</name>
        <values>4</values>
    </parameter>
    <parameter>
        <item>173</item>
        <category>1</category>
        <name>2</name>
        <values>3</values>
    </parameter>
    <parameter>
        <item>176</item>
        <category>1</category>
        <name>2</name>
        <values>3</values>
    </parameter>
    <parameter>
        <item>179</item>
        <category>1</category>
        <name>2</name>
        <values>3</values>
    </parameter>
    <parameter>
        <item>180</item>
        <category>1</category>
        <name>2</name>
        <values>3</values>
    </parameter>
    <parameter>
        <item>184</item>
        <category>1</category>
        <name>2</name>
        <values>3</values>
    </parameter>
    <parameter>
        <item>189</item>
        <category>1</category>
        <name>2</name>
        <values>3</values>
    </parameter>
    <parameter>
        <item>199</item>
        <category>1</category>
        <name>2</name>
        <values>4</values>
    </parameter>
    <parameter>
        <item>200</item>
        <category>1</category>
        <name>2</name>
        <values>2</values>
    </parameter>
    <parameter>
        <item>202</item>
        <category>1</category>
        <name>2</name>
        <values>3</values>
    </parameter>
    <parameter>
        <item>219</item>
        <category>1</category>
        <name>2</name>
        <values>4</values>
    </parameter>
    <parameter>
        <item>240</item>
        <category>1</category>
        <name>2</name>
        <values>4</values>
    </parameter>
    <parameter>
        <item>271</item>
        <category>1</category>
        <name>2</name>
        <values>4</values>
    </parameter>
    <parameter>
        <item>273</item>
        <category>1</category>
        <name>2</name>
        <values>4</values>
    </parameter>
</parameters>